CommentID,CommentTime,RootID,CommentRaw,Comment,CommentLike,CommentReply,UserID,UserName,UserLocation,UserDescription,UserGender,UserFan,UserFollow,UserWeibo,UserVerified,UserFanTitle,VipRank
4385798856317045	,Sat Jun 22 01:49:54 +0800 2019,0,虽然崩坏三的人物动作也没少抄，但是至少没这么多也做的不这么直白，虽然崩坏三这个游戏我已经恨透了，但至少质量还在那，我对米忽悠公司本身还抱有期望，直到看见这个原神。一开始大家都说可能只是pv碰瓷什么的，现在自然都懂了。,虽然崩坏三的人物动作也没少抄，但是至少没这么多也做的不这么直白，虽然崩坏三这个游戏我已经恨透了，但至少质量还在那，我对米忽悠公司本身还抱有期望，直到看见这个原神。一开始大家都说可能只是pv碰瓷什么的，现在自然都懂了。,0,0,3570585071	,SilvermoonO_o,其他,为人民服务,m,77,370,334,False,Null,0
4385798574824531	,Sat Jun 22 01:48:46 +0800 2019,0,[嘻嘻][嘻嘻][嘻嘻][嘻嘻]给爷爪巴,给爷爪巴,0,0,5090649032	,变成富婆吧,湖北,明天一定变,f,177,367,5660,False,Null,0
4385788395115154	,Sat Jun 22 01:08:19 +0800 2019,0,借鉴的不错，希望收费也一起借鉴，别让我看到什么328和648。借鉴就找好的地方借鉴，而不是让你借鉴出别的游戏的一个壳来继续推销卖不出去的水晶钻石,借鉴的不错，希望收费也一起借鉴，别让我看到什么328和648。借鉴就找好的地方借鉴，而不是让你借鉴出别的游戏的一个壳来继续推销卖不出去的水晶钻石,0,0,5455218417	,僵尸时代2277,北京 丰台区,,m,64,54,75,False,Null,0
4385787984687247	,Sat Jun 22 01:06:42 +0800 2019,0,什么年代了？还在接着抄？正版意识已经越来越强了好吧 明眼人都看得出来[doge],什么年代了？还在接着抄？正版意识已经越来越强了好吧 明眼人都看得出来,0,0,6606356927	,这是个本子花,浙江 湖州,哦豁,m,10,96,366,False,Null,0
4385787158703237	,Sat Jun 22 01:03:25 +0800 2019,0,我就想说，游戏行业真的走远了，出的什么垃圾游戏。,我就想说，游戏行业真的走远了，出的什么垃圾游戏。,0,0,5298402488	,小北方神涯,四川 成都,游戏爱好者 文学爱好者 爱CDC,m,149,305,105,False,Null,0
4385786818006696	,Sat Jun 22 01:02:04 +0800 2019,0,辣鸡游戏，希望你永远挂在墙头上,辣鸡游戏，希望你永远挂在墙头上,0,0,2692038797	,Calvarie游,山东 青岛,低智少女。也可以叫大哥没关系,f,158,807,4258,False,Null,0
4385782846519204	,Sat Jun 22 00:46:17 +0800 2019,0,@YYJturbo,@YYJturbo,0,0,5338469576	,一及万亿,上海,,m,207,225,107,False,Null,0
4385781160172142	,Sat Jun 22 00:39:35 +0800 2019,0,原来前几天官宣的旷野之息续作是你们做的[微笑][微笑][微笑],原来前几天官宣的旷野之息续作是你们做的,0,0,2020512641	,百歌小天才,四川,含辛茹苦带大柴犬反被拆家,f,114,359,3658,False,Null,0
4385775502203982	,Sat Jun 22 00:17:06 +0800 2019,0,为了捞钱脸都不要了,为了捞钱脸都不要了,1,0,6357049093	,你比我胖哦,其他,心死了！,m,17,37,48,False,Null,0
4385774432593271	,Sat Jun 22 00:12:50 +0800 2019,0,我就想问……众泰的汽车某些车型，部分外观和某些豪华品牌相似度极高，你们能说这也是人家的原创？昂哈？只因为里面的发动机不一样就是原创了？昂？[阴险],我就想问……众泰的汽车某些车型，部分外观和某些豪华品牌相似度极高，你们能说这也是人家的原创？昂哈？只因为里面的发动机不一样就是原创了？昂？,0,0,1668034214	,Lost_2021,江苏 苏州,,m,548,496,1534,False,Null,0
4385772998053845	,Sat Jun 22 00:07:09 +0800 2019,0,呸！！！！！！！！！！！！！,呸！！！！！！！！！！！！！,0,0,1790321283	,地-瓜,广东 深圳,那个…………唉！算了~……,m,421,366,1625,False,Null,0
4385772113134411	,Sat Jun 22 00:03:38 +0800 2019,0,为什么抽奖不送switch 送ps4？是将来准备移植ps4 好圆大家在ps平台上玩塞尔达的愿望吗？,为什么抽奖不送switch 送ps4？是将来准备移植ps4 好圆大家在ps平台上玩塞尔达的愿望吗？,0,0,5481358504	,ZELDA_WAN,湖北 武汉,,f,41,143,30,False,Null,0
4385771324474590	,Sat Jun 22 00:00:30 +0800 2019,0,@_西霖,@_西霖,0,0,2156602244	,Lu5h1ife,陕西 西安,说实话  有那么一点难受,m,99,110,23,False,Null,0
4385768182724445	,Fri Jun 21 23:48:00 +0800 2019,0,来踩一脚,来踩一脚,0,0,6355385303	,冷了70626,吉林,,f,0,25,2,False,Null,0
4385767134498941	,Fri Jun 21 23:43:51 +0800 2019,0,加油奥，还有很多好游戏呢，全抄进去也许真就煮成一锅粥变成新游戏了呢[微笑]wdnmd,加油奥，还有很多好游戏呢，全抄进去也许真就煮成一锅粥变成新游戏了呢wdnmd,0,0,5985268786	,北贝95,其他,,m,11,90,280,False,Null,0
4385766287263437	,Fri Jun 21 23:40:29 +0800 2019,0,过来吐口痰嗷[太开心][太开心][太开心][太开心],过来吐口痰嗷,0,0,1748149010	,桃黑亭,福建 福州,乌拉拉,m,220,454,5835,False,loyal_fans,0
4385765595078360	,Fri Jun 21 23:37:44 +0800 2019,0,我头一次看到连音效都抄的sb玩意儿 看了直播才发现还抄了尼尔[吐],我头一次看到连音效都抄的sb玩意儿 看了直播才发现还抄了尼尔,6,3,5782527935	,亚希露,江西,条条我老婆！,f,43,451,1272,False,Null,0
4837932193813586	,Sun Nov 20 17:26:22 +0800 2022,4385765595078360	,同考古，那你在原神超话干啥呢,同考古，那你在原神超话干啥呢,0,Null,7766444420	,烛虚cron,湖北 武汉,您诸位好哇(〜￣▽￣)〜,f,1,38,37,False,Null,0
4836112415328671	,Tue Nov 15 16:55:13 +0800 2022,4385765595078360	,22年前来考古[doge],22年前来考古,0,Null,7772408887	,bo_白色大月亮,其他,,m,0,50,6,False,Null,0
4385765926137843	,Fri Jun 21 23:39:03 +0800 2019,4385765595078360	,之前还犹豫入不入switch 你整这波ok下单,之前还犹豫入不入switch 你整这波ok下单,2,Null,5782527935	,亚希露,江西,条条我老婆！,f,43,451,1272,False,Null,0
4385763146279855	,Fri Jun 21 23:28:00 +0800 2019,0,我一直是蛮支持国产的，其实就算是抄袭玩法，我觉得只要有自己的东西，我觉得也没什么问题，但元神已经不是抄玩法了，根本就是把玩家当傻子。这尼玛画风玩法，全都是塞尔达的影子，抄作业好歹也改改啊，老早之前就以国产动作之魂自居，现在还恬不知耻地照搬，可有点数吧,我一直是蛮支持国产的，其实就算是抄袭玩法，我觉得只要有自己的东西，我觉得也没什么问题，但元神已经不是抄玩法了，根本就是把玩家当傻子。这尼玛画风玩法，全都是塞尔达的影子，抄作业好歹也改改啊，老早之前就以国产动作之魂自居，现在还恬不知耻地照搬，可有点数吧,1,0,5685282122	,完美的瓶子君,其他,Life is Strange！,m,155,324,644,False,Null,0
4385762424037663	,Fri Jun 21 23:25:08 +0800 2019,0,我还以为是谁做了塞尔达的换头mod结果居然是个手游，这抄的也太明显了，能不能要点脸[费解],我还以为是谁做了塞尔达的换头mod结果居然是个手游，这抄的也太明显了，能不能要点脸,0,0,1758941842	,喵喵喵喵小靓,其他,什么都喜欢，横跨各种圈,f,839,4518,4461,False,Null,0
4385761455938290	,Fri Jun 21 23:21:16 +0800 2019,0,抄袭塞尔达，真无耻。。,抄袭塞尔达，真无耻。。,0,0,6105681925	,可乐君_10969,海外,,m,86,151,469,False,Null,0
4385758775098021	,Fri Jun 21 23:10:38 +0800 2019,0,抄袭🐶你好,抄袭🐶你好,0,0,3990027966	,阿林LA,上海 黄浦区,空落落,m,1044,287,50,False,Null,0
4385758770885599	,Fri Jun 21 23:10:37 +0800 2019,0,抄袭塞尔达盗取别人努力的成果真的丢脸,抄袭塞尔达盗取别人努力的成果真的丢脸,0,0,2237741850	,关老师就是我,广东 广州,一名骚气的美术老师,m,461,620,49,False,Null,0
4385758565355579	,Fri Jun 21 23:09:47 +0800 2019,0,我瞅着您该抽ns啊[微笑],我瞅着您该抽ns啊,0,0,2644330113	,一·Rowan·一,其他,𝙒𝙞𝙩𝙝 𝙖 𝙡𝙞𝙩𝙩𝙡𝙚 𝙡𝙪𝙘𝙠.,f,763,431,3298,False,Null,0
4385758481837664	,Fri Jun 21 23:09:28 +0800 2019,0,怎么说呢，塞尔达目前可以说是游戏界的一座高峰，大概有珠穆朗玛那么高，能与之比肩的游戏目前来说寥寥无几，但由于ns平台在大陆的局限性，较国内庞大的手游玩家，塞尔达的知名度并不算高。但任何一个热爱游戏的人都不会想看到这种神作被劣质的仿冒，厂商恰烂钱。所以，想玩原神的朋友出来拉一波黑吧。,怎么说呢，塞尔达目前可以说是游戏界的一座高峰，大概有珠穆朗玛那么高，能与之比肩的游戏目前来说寥寥无几，但由于ns平台在大陆的局限性，较国内庞大的手游玩家，塞尔达的知名度并不算高。但任何一个热爱游戏的人都不会想看到这种神作被劣质的仿冒，厂商恰烂钱。所以，想玩原神的朋友出来拉一波黑吧。,0,0,2409716695	,Haoyun0402,重庆 南岸区,,m,343,208,57,False,Null,0
4385750013029756	,Fri Jun 21 22:35:48 +0800 2019,0,没点脸的？？？？,没点脸的？？？？,0,0,1731597137	,_肉山小魔王-此号已废,北京 朝阳区,嗨,m,1007,333,498,False,Null,0
4385749971232225	,Fri Jun 21 22:35:38 +0800 2019,0,出一个二手ns和一个赛尔达卡带，毕竟现在可以在pc上玩到赛尔达了，感谢米哈游还原神作,出一个二手ns和一个赛尔达卡带，毕竟现在可以在pc上玩到赛尔达了，感谢米哈游还原神作,0,0,5040810031	,yahaha617,山东 威海,,m,65,219,380,False,Null,0
4385749569328339	,Fri Jun 21 22:34:03 +0800 2019,0,祝你游拿不到版号糊穿地心[中国赞],祝你游拿不到版号糊穿地心,0,0,1791359653	,细佬b仔唔姓何,广东 广州,浅发追星疯,f,11404,1367,15747,True,Null,7
4385748528311268	,Fri Jun 21 22:29:55 +0800 2019,0,你咋不抽奖switch并且送附带dlc的塞尔达传说：荒野之息呢？[嘻嘻],你咋不抽奖switch并且送附带dlc的塞尔达传说：荒野之息呢？,0,2,2448277477	,佐尼斯_布莱克,浙江 温州,乐是一天苦是一天,m,243,879,10810,False,Null,0
4385747555158079	,Fri Jun 21 22:26:03 +0800 2019,0,为啥不送switch？[嘻嘻],为啥不送switch？,0,0,6501548549	,人上人下人上人下人,北京,IENSFTPJ/,m,18,263,858,False,Null,0
4385744212616831	,Fri Jun 21 22:12:46 +0800 2019,0,看到大家都在骂你，我就放心了。作为一个游戏开发者，去侮辱真正带来快乐的游戏，是不是要扪心自问一下，自己已经变成了最肮脏的大人呢,看到大家都在骂你，我就放心了。作为一个游戏开发者，去侮辱真正带来快乐的游戏，是不是要扪心自问一下，自己已经变成了最肮脏的大人呢,0,0,2140050384	,BL青涩UE,四川 成都,青呱,m,38,219,1038,False,Null,0
4385743633505455	,Fri Jun 21 22:10:27 +0800 2019,0,抄袭 我靠,抄袭 我靠,0,0,5791868816	,脏脏麻薯,海外,跑起来就会有风,f,64,237,1762,False,Null,0
4385742187290199	,Fri Jun 21 22:04:43 +0800 2019,0,我什么游戏都玩，cf啊，cs啊，神海4啊，鬼泣啊，等等所有平台的pc，ps4，ns，手游这些我都一视同仁，不过大部分都是玩外国游戏，那些大作都能给我不同的震撼和快乐，然后我就在期待啊，什么时候中国，什么时候自己的祖国，能出一个让我自己骄傲的大作，我一直一直，然后原神出来了，一下子就心寒了！,我什么游戏都玩，cf啊，cs啊，神海4啊，鬼泣啊，等等所有平台的pc，ps4，ns，手游这些我都一视同仁，不过大部分都是玩外国游戏，那些大作都能给我不同的震撼和快乐，然后我就在期待啊，什么时候中国，什么时候自己的祖国，能出一个让我自己骄傲的大作，我一直一直，然后原神出来了，一下子就心寒了！,0,1,6580186374	,熬屠漫aole,其他,,m,19,411,426,False,Null,0
4385742077330188	,Fri Jun 21 22:04:16 +0800 2019,0,“在野外战斗成功清理掉营地敌人之后，游戏还会给一个营地箱子解锁的特写”看了实况，这™的一模一样啊，其他一样的就不提了！简直恶心！本来我以为你就PV碰瓷呢，你们准备整个游戏都碰瓷塞尔达传说是吗？亏得我还帮你们说好话！你们好歹留点自己的东西在自己的游戏里面吧！哪怕一点呢！,“在野外战斗成功清理掉营地敌人之后，游戏还会给一个营地箱子解锁的特写”看了实况，这™的一模一样啊，其他一样的就不提了！简直恶心！本来我以为你就PV碰瓷呢，你们准备整个游戏都碰瓷塞尔达传说是吗？亏得我还帮你们说好话！你们好歹留点自己的东西在自己的游戏里面吧！哪怕一点呢！,0,0,6026976432	,飞翔湖南人,湖南 长沙,我是小七,m,37,46,105,False,Null,0
4385741042264629	,Fri Jun 21 22:00:09 +0800 2019,0,怎么不抽ns[微笑],怎么不抽ns,0,0,1853689874	,·李鲤鲤·,湖南 长沙,ʕ•̫͡•ོʔ•̫͡•ཻʕ•̫͡•ʔ•͓͡•ʔ,f,412,160,4075,False,Null,0
4385740437634092	,Fri Jun 21 21:57:46 +0800 2019,0,我现在想玩国产宝可梦，和大镖客里，期待你们下一部作品[doge],我现在想玩国产宝可梦，和大镖客里，期待你们下一部作品,0,0,3291036830	,南十川,海外,不会写简介，下笔就是一个故事,f,159,193,8315,False,Null,0
4385740202620280	,Fri Jun 21 21:56:50 +0800 2019,0,敢不敢送ns🌝,敢不敢送ns🌝,0,0,1998600140	,Ohtani17,广东 深圳,"滑板&鱼竿,大谷&翔平,🐰&🐲;あいみよん,平泽唯,木之本樱,松前绪花;妙蛙&泡沫蛙",f,219,261,575,False,Null,0
4385738902479306	,Fri Jun 21 21:51:39 +0800 2019,0,不要脸,不要脸,0,0,3493954257	,无-聊-_-,江苏 南京,,m,23,301,199,False,Null,0
4385738160558901	,Fri Jun 21 21:48:42 +0800 2019,0,还 原神 作,还 原神 作,0,0,1862801017	,迷路的胖哒,四川,,m,104,205,366,False,Null,0
4385732938298827	,Fri Jun 21 21:27:58 +0800 2019,0,真不要碧脸 刘伟s个🐴先,真不要碧脸 刘伟s个🐴先,0,0,2096841197	,odd__y,上海 浦东新区,,f,196,86,5,False,Null,0
4385732762380071	,Fri Jun 21 21:27:15 +0800 2019,0,这就是塞尔达：荒野之息的续作pv吗，感觉不如荒野之息啊。果然任天堂已经不行了[doge],这就是塞尔达：荒野之息的续作pv吗，感觉不如荒野之息啊。果然任天堂已经不行了,0,0,5521448434	,人穷志短败嗨风_,其他,努力学习画画中/,m,39,322,1590,False,Null,0
4385731399494321	,Fri Jun 21 21:21:50 +0800 2019,0,臭鱼烂虾mihoyo，好的不学，学你马翟天临呢？,臭鱼烂虾mihoyo，好的不学，学你马翟天临呢？,0,0,5534535777	,吡数自在人心,上海 奉贤区,,m,4,56,14,False,Null,0
4385730732033985	,Fri Jun 21 21:19:11 +0800 2019,0,有做好游戏的能力，非要搞抄袭，伤心了,有做好游戏的能力，非要搞抄袭，伤心了,0,0,6328662393	,龙武文A,浙江 杭州,飘过，路过,m,34,193,47,False,Null,0
4385727674180427	,Fri Jun 21 21:07:03 +0800 2019,0,我突然想到了！！！我想玩荒野大镖客2，巫师3，使命召唤15，战地1，赛博朋克2077手游版！！！谢谢！！！,我突然想到了！！！我想玩荒野大镖客2，巫师3，使命召唤15，战地1，赛博朋克2077手游版！！！谢谢！！！,0,0,6519424908	,RaonLeee,其他,,m,37,69,8,False,Null,0
4385724470305617	,Fri Jun 21 20:54:19 +0800 2019,0,呕,呕,0,0,2244179082	,普普通通的朋友,广东 汕头,失去比拥有更轻松,m,887,857,9135,False,Null,0
4385721890284916	,Fri Jun 21 20:44:04 +0800 2019,0,md求您别抄了,md求您别抄了,0,0,5881767652	,云幕遮_,广东 广州,比生命更远，我想用死亡对你说爱。比爱更远，我想用遗忘对你说爱。,f,70,2187,1376,False,Null,0
4385720036961238	,Fri Jun 21 20:36:41 +0800 2019,0,老师从小就教会我们抄袭别人的作业，别人的成果[doge][doge][doge],老师从小就教会我们抄袭别人的作业，别人的成果,0,0,6519424908	,RaonLeee,其他,,m,37,69,8,False,Null,0
4385718702718306	,Fri Jun 21 20:31:24 +0800 2019,0,博主你看着这些回复不尴尬的吗？,博主你看着这些回复不尴尬的吗？,0,0,6519424908	,RaonLeee,其他,,m,37,69,8,False,Null,0
4385718606929508	,Fri Jun 21 20:31:01 +0800 2019,0,我想要资格[太开心][太开心][太开心][太开心][太开心],我想要资格,0,0,7190373157	,scenery2006,其他,,m,0,8,0,False,Null,0
4385718576768752	,Fri Jun 21 20:30:54 +0800 2019,0,我求求你们送塞尔达吧,我求求你们送塞尔达吧,0,0,6027962900	,UED-TERRAN,其他,,m,15,150,6,False,Null,0
4385715510982408	,Fri Jun 21 20:18:43 +0800 2019,0,绝了我日，这相似度也太明显了⑧？卧槽这我洗地都不知道咋给你们洗啊？塞尔达好歹也是个老牌IP，玩家也不少，ns在大陆销量更是不低，你们咋能抄的这么明目张胆啊？别吧大兄弟，你们这么整我洗地都不好意思开口行不行？,绝了我日，这相似度也太明显了⑧？卧槽这我洗地都不知道咋给你们洗啊？塞尔达好歹也是个老牌IP，玩家也不少，ns在大陆销量更是不低，你们咋能抄的这么明目张胆啊？别吧大兄弟，你们这么整我洗地都不好意思开口行不行？,1,0,1853204270	,班西的面具,北京,粉身碎骨浑不怕，但留清白在世间,f,213,2207,4124,False,Null,6
4385713438699034	,Fri Jun 21 20:10:29 +0800 2019,0,官方该站出来说两句话了，借鉴就老实说借鉴。老实说游戏间相互借鉴的不少大厂们也一样，关键是你得出來说两句，装死没人会同情你，包括真粉丝。,官方该站出来说两句话了，借鉴就老实说借鉴。老实说游戏间相互借鉴的不少大厂们也一样，关键是你得出來说两句，装死没人会同情你，包括真粉丝。,1,0,6170174336	,毕业生24164,其他,,m,8,40,3,False,Null,0
4385711618681460	,Fri Jun 21 20:03:14 +0800 2019,0,赚了钱开始飘了，明目张胆开始抄？,赚了钱开始飘了，明目张胆开始抄？,0,0,5713508225	,樱桃小丸子的x先生,陕西,一想到要和你共度余生，我就充满期待。,m,47,125,77,False,Null,0
4385711312618936	,Fri Jun 21 20:02:02 +0800 2019,0,别做成第二个崩三，角色抽卡，武器也抽卡，最后搞的有武器没角色有角色没武器这种玩意，搞的氪金体验差，不氪金体验也差。希望角色不用多系统能自送，武器可以抽，每个角色适用的武器，不是只有一种类型，可以主修副修。比如主角能用剑和枪之类的，还和崩三一样，即使没人说你抄塞尔达，我也会很失望。,别做成第二个崩三，角色抽卡，武器也抽卡，最后搞的有武器没角色有角色没武器这种玩意，搞的氪金体验差，不氪金体验也差。希望角色不用多系统能自送，武器可以抽，每个角色适用的武器，不是只有一种类型，可以主修副修。比如主角能用剑和枪之类的，还和崩三一样，即使没人说你抄塞尔达，我也会很失望。,1,0,6170174336	,毕业生24164,其他,,m,8,40,3,False,Null,0
4385711027599756	,Fri Jun 21 20:00:53 +0800 2019,0,我国毕竟人口众多发展程度不均衡，所以粗制滥造的抄袭垃圾也有一堆人捧场，不奢求所有人都有版权意识都能舍得花两千玩旷野之息，只希望每个玩到这款游戏的人终有一天会明白，原神这种东西能端上我国的游戏台面是对每个游戏爱好者莫大的羞辱,我国毕竟人口众多发展程度不均衡，所以粗制滥造的抄袭垃圾也有一堆人捧场，不奢求所有人都有版权意识都能舍得花两千玩旷野之息，只希望每个玩到这款游戏的人终有一天会明白，原神这种东西能端上我国的游戏台面是对每个游戏爱好者莫大的羞辱,48,24,3199717412	,Sunsettttttt,北京,It’s better to have loved and lost than never to have loved at all💔,m,21,170,41,False,Null,0
4458777036189198	,Thu Jan 09 10:59:08 +0800 2020,4385711027599756	,如果可以你先把手柄扔了，当年手柄竞争发展没一个白净的,如果可以你先把手柄扔了，当年手柄竞争发展没一个白净的,1,Null,6453937854	,鱼古墓,其他,天下乌鸦一般黑,m,1,91,1,False,Null,0
4445453426387466	,Tue Dec 03 16:35:52 +0800 2019,4385711027599756	,能玩到原神我刚到很荣幸,能玩到原神我刚到很荣幸,1,Null,6585991584	,凉尽初夏h,其他,落子无悔，永远少年,m,0,10,6,False,Null,0
4415003282902949	,Tue Sep 10 15:57:52 +0800 2019,4385711027599756	,附议,附议,0,Null,6915778603	,Yisanamisuyao_,其他,不能为空,m,5,8,103,False,Null,0
4407183078804170	,Tue Aug 20 02:03:10 +0800 2019,4385711027599756	,woc这都算粗制滥造。。。那某些大厂的换皮游戏岂不是。。。,woc这都算粗制滥造。。。那某些大厂的换皮游戏岂不是。。。,5,Null,7087027730	,云夜悠长,四川,,m,1,29,63,False,Null,0
4405502111169214	,Thu Aug 15 10:43:36 +0800 2019,4385711027599756	,中国维权网，有举报抄袭功能，慢走不送，提醒一下有法律责任哦,中国维权网，有举报抄袭功能，慢走不送，提醒一下有法律责任哦,4,Null,3168231142	,墨凌GG,其他,,m,4,55,22,False,Null,0
4400802216838945	,Fri Aug 02 11:27:54 +0800 2019,4385711027599756	,回复@冰晶王子K:因为口嗨不用成本，网络正义不用负责,回复@冰晶王子K:因为口嗨不用成本，网络正义不用负责,2,Null,6315648746	,君勿笑775,湖南,,m,2,29,0,False,Null,0
4400780482598022	,Fri Aug 02 10:01:32 +0800 2019,4385711027599756	,这么羞愧怎么不已死明志！,这么羞愧怎么不已死明志！,5,Null,5728811560	,冰晶王子K,河北,一个不冷的天蝎男(づ ●─● )づ。,m,38,78,26,False,Null,0
4395779819268908	,Fri Jul 19 14:50:41 +0800 2019,4385711027599756	,笑啦,笑啦,0,Null,5912605778	,浴沝木08144,其他,,m,0,42,0,False,Null,0
4386340332322556	,Sun Jun 23 13:41:32 +0800 2019,4385711027599756	,问题是这些人潜意识里认为抄袭就是对的,问题是这些人潜意识里认为抄袭就是对的,6,Null,6277567656	,ok啦桑不啦批泡,吉林,,m,121,86,93,False,Null,0
4385885435143092	,Sat Jun 22 07:33:56 +0800 2019,4385711027599756	,明白人,明白人,1,Null,5976133248	,沢--,上海 黄浦区,/,m,89,324,20,False,Null,0
4385740781637310	,Fri Jun 21 21:59:07 +0800 2019,4385711027599756	,这款作品让我为国家游戏行业感到羞愧。,这款作品让我为国家游戏行业感到羞愧。,4,Null,6409942961	,香芋西米露加椰奶,广东 深圳,少冰，谢谢,m,66,496,1040,False,Null,0
4385711022978513	,Fri Jun 21 20:00:53 +0800 2019,0,有一天，大约是中秋前的两三天，掌柜正在慢慢的结账，取下粉板，忽然说，“米忽悠长久没有来了。还欠十九个钱呢！”才也一个喝酒的人说道，“他怎么会来？……他打折了腿了。”掌柜说，“哦！”“他总仍旧是偷。这一回，是自己发昏，竟偷到任地狱家里去了。他家的东西，偷得的么？”,有一天，大约是中秋前的两三天，掌柜正在慢慢的结账，取下粉板，忽然说，“米忽悠长久没有来了。还欠十九个钱呢！”才也一个喝酒的人说道，“他怎么会来？……他打折了腿了。”掌柜说，“哦！”“他总仍旧是偷。这一回，是自己发昏，竟偷到任地狱家里去了。他家的东西，偷得的么？”,0,0,6831588813	,惭渊,吉林 吉林,世界尽头骑手,m,5,8,14,False,Null,0
4385707860450473	,Fri Jun 21 19:48:19 +0800 2019,0,奖励可以改成送switch玩塞尔达[微笑],奖励可以改成送switch玩塞尔达,0,0,2654558603	,哎羊刁刁,四川 成都,汉服圈外人士，养狗人，游戏渣，山风团爱竹马的黄担！！,f,360,735,348,False,Null,0
4385707261004501	,Fri Jun 21 19:45:56 +0800 2019,0,路人不知道抄没抄，但是3d做的挺好啊[二哈],路人不知道抄没抄，但是3d做的挺好啊,0,0,6023812323	,不喜欢兄弟那叫年轻人吗,其他,白原/私博。得了看见自己发过的东西就会少活几年的怪病。会回关不需要礼貌回关。,f,101,391,2969,False,loyal_fans,0
4385704844519026	,Fri Jun 21 19:36:20 +0800 2019,0,在？讲讲什么叫热情？ http://t.cn/AipwE3be,在？讲讲什么叫热情？ ,2,1,5509634356	,摸鱼队长Arno11,其他,。,m,35,172,63,False,Null,0
4385705524161510	,Fri Jun 21 19:39:01 +0800 2019,4385704844519026	,为啥不抽ns呢 放心 大家都不知道ns是什么的[二哈],为啥不抽ns呢 放心 大家都不知道ns是什么的,0,Null,5509634356	,摸鱼队长Arno11,其他,。,m,34,172,63,False,Null,0
4385704194561682	,Fri Jun 21 19:33:45 +0800 2019,0,抄得可以啊米忽悠,抄得可以啊米忽悠,0,0,3545670304	,吃饭睡觉撸豆,山东 济南,,m,277,516,8041,False,Null,0
4385703976679533	,Fri Jun 21 19:32:52 +0800 2019,0,一个游戏做到了玩法框架、关卡设计、互动机制、美术风格、世界观背景、背景音乐、UI设计样样都非常像塞尔达，人物动作和镜头甚至到了一模一样的地步，我想问问如果这都不算抄袭，那什么是抄袭,一个游戏做到了玩法框架、关卡设计、互动机制、美术风格、世界观背景、背景音乐、UI设计样样都非常像塞尔达，人物动作和镜头甚至到了一模一样的地步，我想问问如果这都不算抄袭，那什么是抄袭,2,0,6277567656	,ok啦桑不啦批泡,吉林,,m,121,86,93,False,Null,0
